Nom,Origines,Pitch,Rang 1,Rang 2,Rang 3,,,,,,,,,,,,,,,,,,,,,,,,
Sanctuaire,,Arme évoquée => Action Défensive (défense/tact) via PM ou sacrifice charge,"Lorsque le personnage réalise des actions de défense ou tactique via une arme évoquée il peux dépenser des PM pour obtenir un bonus de 1, ce bonus ne peux pas dépasser la différence entre la défense passive de magie de la cible et la défense passive à laquelle s'oppose l'attaque OU 2, le plus petit des deux (donc si la défense magique de la cible est trop élevée il n'est pas possible de dépenser de PM de la sorte)","Le maximum passe à 3, de plus le personnage peux décider de sacrifier son arme évoquée en vidant celle ci de ses charges afin d'ajouter la moitié au jet de l'action","Le maximum passe à 5, si les charges sont sacrifiées le gain est de 1 pour 1",,,,,,,,,,,,,,,,,,,,,,,,
Carnassier,,Blessures cible => Bonus & Jet,"Les actions de combats du personnage reçoivent un bonus de 1, ce bonus est limité par les pénalités de blessures de sa cible, il reçoit également le double en bonus à ses jets",Les bonus passent à 2 et 4,Les bonus passent à 3 et 6,,,,,,,,,,,,,,,,,,,,,,,,
Souffrance,,Blessures soi => Bonus & Jet,"Les actions de combats du personnage reçoivent un bonus de 1, ce bonus est limité par les pénalités de blessures du personnage, il reçoit également le double en bonus à ses jets",Les bonus passent à 2 et 4,Les bonus passent à 3 et 6,,,,,,,,,,,,,,,,,,,,,,,,
Impulsion,,Charge => moins de pénalités ? etc,,,,,,,,,,,,,,,,,,,,,,,,,,,
Précision,,Tirs avec pénalités dû aux distances => Jet,"Les tirs réalisés par le personnage qui souffre de désavantage dû à la distance (trop près ou trop long), alors le jet est avantagé, si le personnage n'est pas affecté par les désavantages il ne peux profiter de cet effet","Le jet reçoit autant d'avantage que de désavantage au test le cas échéant, de plus si le test est à minima désavantagé le jet est assuré (minimum +1, soit 2)","Si le test est à minima désavantagé le jet est très très assuré (minimum +3, soit 4)",,,,,,,,,,,,,,,,,,,,,,,,
Rechargement,,Recharger lors d'un déplacement,Lorsque le personnage réalise un déplacement d'au moins 3m il peux réduire le cout en initiative de son action de rechargement de 1 s'il la réalise sur-le-champs,La réduction est de 2,"La réduction est de 3, un pas de placement peux réduire le cout de 1 à la place",,,,,,,,,,,,,,,,,,,,,,,,
Valkirie,Valkirie d'Arkadar,Attaque via un bond vertical => Bonus & Jet & criticité,"Lorsque le personnage réalise une attaque physique en tombant depuis une position plus élevée (dans sa position de départ ses pieds sont au dessus de la tête, ou du point le plus haut, de sa cible) d'au moins 3m, il profite drastiquement de la hauteur, il reçoit alors un bonus de 1 à son test, un bonus de 2 à son jet et un bonus de 1 à la criticité de l'action","Si la distance est de 5m et plus, les bonus passent respectivement à 2/4/2","Si la distance est de 7m et plus, les bonus passent à 3/6/3",,,,,,,,,,,,,,,,,,,,,,,,
Opiniâtreté,,"PE < 0 : Contre attaque ou riposte possible, il peux faire cela en plus d'une autre action rapide/interruption chaque round","Si le personnage est en état de choc et qu'il fait l'objet d'une attaque il peux décider de contre attaquer ou de riposter, l'action se fait avec une action rapide dont le cout en initiative est augmenté de 2, soit 7",Le cout est normal (5),Le cout est de 3 à la place,,,,,,,,,,,,,,,,,,,,,,,,
Obstination,,PE < 0 : Défenses accrues,Si le personnage est en état de choc il compense de 1 la perte de défense passive,Compense jusqu'à 2,Compense jusqu'à 3,,,,,,,,,,,,,,,,,,,,,,,,
Dévotion,,Défense du maitre,"Le personnage peux désigner un des participants à une confrontation comme étant son maitre, il doit pour ça avoir un lien notable avec celui ci, sinon ce n'est pas une cible valide, être d'égal à égal peux suffire mais dans ce cas l'effet est divisé par deux, toutes les actions du personnage visant à protéger le ""maitre"" reçoivent un ajustement de 2",Le bonus est de 4,Le bonus est de 6,,,,,,,,,,,,,,,,,,,,,,,,
Sérénité,,Pacifiste,Tant que le personnage n'a pas réalisé d'action agressive (attaque ou tactique) il a ses défenses passives augmentée de 1,Le bonus passe à 2,Le bonus passe à 3,,,,,,,,,,,,,,,,,,,,,,,,
Expertise,,Tir réalisé à portée longue => Maitrise,"Tant que le personnage réalise un tir à portée longue son attaque reçoit un bonus de maitrise de 2, notons qu'une telle portée implique généralement des pénalités",Le bonus est de 4,Le bonus est de 6,,,,,,,,,,,,,,,,,,,,,,,,
Portée,,Tir réalisé à portée idéale => Ajustement,"Tant que le personnage réalise un tir à portée idéale (ni courte, ni longue) son attaque reçoit un bonus d'ajustement de 1",Le bonus passe à 2,Le bonus passe à 3,,,,,,,,,,,,,,,,,,,,,,,,
Proximité,,Tir réalisé à portée courte => Perforation & Attrition,"Tant que le personnage réalise un tir à portée courte son attaque reçoit un bonus de perforation et d'attrition de 1, notons qu'une telle portée implique généralement des pénalités",Le bonus passe à 2,Le bonus passe à 3,,,,,,,,,,,,,,,,,,,,,,,,
Initiative,,Agir avant la cible => Ajustement,"Si le personnage réalise un test d'attaque ou tactique avant sa cible ce round ci, nécessairement unique, il profite d'un ajustement de 1 à cette dernière",Le bonus passe à 2,Le bonus passe à 3,,,,,,,,,,,,,,,,,,,,,,,,
Anticipation,,Agir après la cible => Ajustement,"Si le personnage réalise un test après que sa cible, nécessairement unique ai réalisé sa passe d'arme ce round ci, il profite d'un ajustement de 1 à cette dernière",Le bonus passe à 2,Le bonus passe à 3,,,,,,,,,,,,,,,,,,,,,,,,
Traquenard,,Cible piégée => Bonus,"Si le personnage réalise un test d'attaque ou tactique et que celle ci a déclanché/subit un piège ce round ci ou le round précédent, le personnage reçoit un bonus de 1",Le bonus passe à 2,Le bonus passe à 3,,,,,,,,,,,,,,,,,,,,,,,,
Embuscade,,Tour de surprise => Bonus & Jet,Si le personnage réalise une action de combat durant son tour de surprise il reçoit un bonus aux tests de 1 et aux jets de 2,Les bonus passent à 2 et 4,Les bonus passent à 3 et 6,,,,,,,,,,,,,,,,,,,,,,,,
Chevalerie,,Combat à la loyal => Bonus,"Si le personnage est en combat à la loyale, c'est à dire que son adversaire et lui se sont entendus sur la raison d'être de l'affrontement (protocol, etc), alors il reçoit un bonus de 1 à ses tests de combat",Le bonus passe à 2,Le bonus passe à 3,,,,,,,,,,,,,,,,,,,,,,,,
Trompeur,,Cible feintée => Bonus (2 tours),"Si le personnage réalise un test de combat contre une cible qu'il a réussis à feinter ce tour ou le tour dernier, il reçoit un bonus de 1",Le bonus passe à 2,Le bonus passe à 3,,,,,,,,,,,,,,,,,,,,,,,,
Provocateur,,Cible provoquée/intimidée => Bonus (2 tours),"Si le personnage réalise un test de combat contre une cible qu'il a réussis à provoquer/intimider/détourner (manipulation) ce tour ou le tour dernier, il reçoit un bonus de 1",Le bonus passe à 2,Le bonus passe à 3,,,,,,,,,,,,,,,,,,,,,,,,
Connaisseur,,Cible identifiée => Ajustement,"Si le personnage réalise un test de combat contre une cible qu'il a identifié (test de connaissance) il reçoit un ajutsment de 1, l'ajustement ne peux dépasser le degré de réussite du test de connaissance en question",Le bonus passe à 2,Le bonus passe à 3,,,,,,,,,,,,,,,,,,,,,,,,
Ciblage,,Cible marquée => Jet,"Le personnage peux dépenser une action simple pour marquée mentalement une cible, il reçoit un bonus à ses jets de 1 aux actions de combat contre celle ci",Le bonus passe à 2,Le bonus passe à 3,,,,,,,,,,,,,,,,,,,,,,,,
Traque,,Cible en fuite => Bonus & Jet & critique,"Si le personnage réalise un test de combat contre une cible en fuite, il reçoit un bonus aux test et en criticité de 1 et un bonus aux jets de 2",Les bonus passent à 2 et 4,Les bonus passent à 3 et 6,,,,,,,,,,,,,,,,,,,,,,,,
Territoire,,Défend son territoire => Bonus,"Si le personnage réalise un test de combat en étant sur son propre territoire alors il reçoit un bonus de 1 à ses tests de combat, le territoire peux prendre la forme d'une batisse ou d'une navire par example (mais pas une cité entière)",Le bonus passe à 2,Le bonus passe à 3,,,,,,,,,,,,,,,,,,,,,,,,
Tandem,,"Combat offensif avec compagnon => Ajustement soi, Bonus compagnon","Si le personnage réalise un test de combat d'attaque ou tactique contre un adversaire qui est également en mêlée avec le compagnon animal du personnage, le test reçoit un ajustement de 1, le compagnon profite d'un effet similaire avec le personnage comme déclancheur et reçoit un bonus de 1 à la place",Le bonus passe à 2,Le bonus passe à 3,,,,,,,,,,,,,,,,,,,,,,,,
Solidarité,,"Combat défensif avec compagnon => Ajustement soi, Bonus compagnon","Si le personnage réalise un test de combat de défense ou tactique contre un adversaire qui est également en mêlée avec le compagnon animal du personnage, le test reçoit un ajustement de 1, le compagnon profite d'un effet similaire avec le personnage comme déclancheur et reçoit un bonus de 1 à la place",Le bonus passe à 2,Le bonus passe à 3,,,,,,,,,,,,,,,,,,,,,,,,
Dressage,,Ordre à un compagnon => Bonus,Si le personnage donne un ordre direct (via une action libre) à son compagnon ce dernier reçoit un bonus de 1 à son test visant à réussir l'ordre en question,Le bonus passe à 2,Le bonus passe à 3,,,,,,,,,,,,,,,,,,,,,,,,
Parade,,Arme légère contre Arme plus lourde => Parade +,,,,,,,,,,,,,,,,,,,,,,,,,,,
Blocage,,Arme lourde contre Arme plus légère => Blocage +,,,,,,,,,,,,,,,,,,,,,,,,,,,
Esquive,,Armure légère contre Arme plus lourde => Esquive +,,,,,,,,,,,,,,,,,,,,,,,,,,,
